imageURL,imageID,original,und_quantity,und_location,und_object,und_gender-number,und_gender,und_full,sim_original,sim_quantity,sim_location,sim_object,sim_gender-number,sim_gender,sim_full
./coco-images/images/COCO_train2014_000000134599.jpg,134599,A large white cake sitting on top of a table.,NA,A large white cake sitting here.,A large white cake sitting on top of that.,NA,NA,They are doing something here.,0.2076,0.0,0.2609,0.193,0.0,0.0,0.0055
./coco-images/images/COCO_train2014_000000324732.jpg,324732,A woman standing in front of a metal refrigerator freezer.,NA,A woman standing here.,A woman standing in front of that.,NA,A person standing in front of a metal refrigerator freezer.,They are doing something here.,0.2311,0.0,-0.046,-0.0046,0.0,0.1829,-0.0338
./coco-images/images/COCO_train2014_000000145499.jpg,145499,A person in a yellow shirt about to ketchup the dog in a hot dog costume.,NA,NA,A person in a yellow shirt about to ketchup the dog in that.,NA,NA,They are doing something here.,0.4251,0.0,0.0,0.3541,0.0,0.0,0.0478
./coco-images/images/COCO_train2014_000000459209.jpg,459209,Two small children playing with their refrigerator magnets.,Some small children playing with their refrigerator magnets.,NA,Two small children playing with this.,NA,Two small people playing with their refrigerator magnets.,They are doing something here.,0.3816,0.3746,0.0,0.1872,0.0,0.3421,0.1687
./coco-images/images/COCO_train2014_000000570019.jpg,570019,A hot dog covered in toppings sitting next to beer.,NA,A hot dog covered in toppings sitting here.,A hot dog covered in this sitting next to beer.,NA,NA,They are doing something here.,0.387,0.0,0.253,0.3908,0.0,0.0,-0.0325
./coco-images/images/COCO_train2014_000000335696.jpg,335696,two women are chatting on a brown bench,some women are chatting on a brown bench,two women are chatting here,NA,they are chatting on a brown bench,two people are chatting on a brown bench,They are doing something here.,0.4149,0.4034,0.2907,0.0,0.3705,0.3826,0.0499
./coco-images/images/COCO_train2014_000000198072.jpg,198072,A motorcyclist with helmet and neon vest taking a photograph in side mirror,NA,A motorcyclist with helmet and neon vest taking a photograph there,A motorcyclist with that taking a photograph in side mirror,NA,A person with helmet and neon vest taking a photograph in side mirror,They are doing something here.,0.4829,0.0,0.409,0.3878,0.0,0.4571,0.0077
./coco-images/images/COCO_train2014_000000468357.jpg,468357,A red laptop on a desk with various devices plugged in.,NA,A red laptop here with various devices plugged in.,A red laptop on a desk with that.,NA,NA,They are doing something here.,0.3457,0.0,0.3458,0.2353,0.0,0.0,0.0448
./coco-images/images/COCO_train2014_000000112029.jpg,112029,Girl laying on bed with a stuffed panda posing for the camera.,NA,Girl laying there with a stuffed panda posing for the camera.,Girl laying on bed with that posing for the camera.,NA,Person laying on bed with a stuffed panda posing for the camera.,They are doing something here.,0.4483,0.0,0.4475,0.2203,0.0,0.4506,0.0704
./coco-images/images/COCO_train2014_000000205931.jpg,205931,A woman painting flowers on a red umbrella.,NA,NA,A woman painting that on a red umbrella.,NA,A person painting flowers on a red umbrella.,They are doing something here.,0.4113,0.0,0.0,0.3341,0.0,0.3617,-0.0315
./coco-images/images/COCO_train2014_000000145499.jpg,145499,A dog inside a stuffed hot dog bun on a man's lap.,NA,NA,A dog inside this on a man's lap.,NA,A dog inside a stuffed hot dog bun on a person's lap.,They are doing something here.,0.3979,0.0,0.0,0.266,0.0,0.4054,0.0478
./coco-images/images/COCO_train2014_000000528563.jpg,528563,The two friends are playing a game on the Wii console.,Some friends are playing a game on the Wii console.,NA,The two friends are playing a game on this.,They are playing a game on the Wii console.,The two people are playing a game on the Wii console.,They are doing something here.,0.3888,0.3879,0.0,0.2717,0.3875,0.3868,0.1256
./coco-images/images/COCO_train2014_000000330652.jpg,330652,Two children lying on the booth seats of a restaurant.,Some children lying on the booth seats of a restaurant.,Two children lying there.,NA,NA,Two people lying on the booth seats of a restaurant.,They are doing something here.,0.4805,0.498,0.2324,0.0,0.0,0.4056,0.1519
./coco-images/images/COCO_train2014_000000184930.jpg,184930,a man holding two very large teddy bears,a man holding some very large teddy bears,NA,a man holding that,NA,a person holding two very large teddy bears,They are doing something here.,0.4111,0.4085,0.0,0.1414,0.0,0.3579,0.0494
./coco-images/images/COCO_train2014_000000196545.jpg,196545,The woman is showing the toppings on her hotdog.,NA,NA,The woman is showing that.,They are showing the toppings on their hotdog.,The person is showing the toppings on their hotdog.,They are doing something here.,0.3756,0.0,0.0,0.0689,0.3071,0.322,0.0348
./coco-images/images/COCO_train2014_000000198072.jpg,198072,A man in a helmet observes his reflection in a motorcycle side mirror.,NA,A man in a helmet observes his reflection there.,A man in a helmet observes this in a motorcycle side mirror.,NA,A person in a helmet observes their reflection in a motorcycle side mirror.,They are doing something here.,0.3836,0.0,0.3047,0.4072,0.0,0.4236,0.0077
./coco-images/images/COCO_train2014_000000439463.jpg,439463,A woman with a wooden pizza board is near a huge oven.,NA,A woman with a wooden pizza board is there.,A woman with a wooden pizza board is near that.,NA,A person with a wooden pizza board is near a huge oven.,They are doing something here.,0.3615,0.0,0.2309,0.2594,0.0,0.359,0.0197
./coco-images/images/COCO_train2014_000000394151.jpg,394151,The woman is standing above the two packed suitcases.,The woman is standing above some packed suitcases.,The woman is standing here.,The woman is standing above this.,They are standing above the two packed suitcases.,The person is standing above the two packed suitcases.,They are doing something here.,0.323,0.3293,0.1602,0.1249,0.309,0.3412,0.0412
./coco-images/images/COCO_train2014_000000096222.jpg,96222,A man standing in front of a cake on a table.,NA,A man standing in front of a cake there.,A man standing in front of that.,NA,A person standing in front of a cake on a table.,They are doing something here.,0.2638,0.0,0.2636,0.1387,0.0,0.2315,0.0608
./coco-images/images/COCO_train2014_000000163939.jpg,163939,A tin cup of noodles in water sitting in front of a computer.,NA,A tin cup of noodles in water sitting here.,NA,NA,NA,They are doing something here.,0.5316,0.0,0.3888,0.0,0.0,0.0,0.0068
./coco-images/images/COCO_train2014_000000122731.jpg,122731,A person with face make up and a multi color umbrella and jacket.,NA,NA,NA,NA,NA,They are doing something here.,0.3407,0.0,0.0,0.0,0.0,0.0,0.0177
./coco-images/images/COCO_train2014_000000324732.jpg,324732,A woman standing next to refrigerators holding a sign.,NA,A woman standing there holding a sign.,A woman standing next to refrigerators holding this.,NA,A person standing next to refrigerators holding a sign.,They are doing something here.,0.2536,0.0,-0.0127,0.2895,0.0,0.2182,-0.0338
./coco-images/images/COCO_train2014_000000075299.jpg,75299,"Two movers with their open moving van, which is parked on a city street.","Some movers with their open moving van, which is parked on a city street.","Two movers with their open moving van, which is parked there.",NA,NA,"Two people with their open moving van, which is parked on a city street.",They are doing something here.,0.3184,0.3577,0.2908,0.0,0.0,0.3161,0.1417
./coco-images/images/COCO_train2014_000000184930.jpg,184930,A man is carrying two extra large teddy bears.,A man is carrying some extra large teddy bears.,NA,A man is carrying that.,They are carrying two extra large teddy bears.,A person is carrying two extra large teddy bears.,They are doing something here.,0.4284,0.4159,0.0,0.1574,0.3452,0.409,0.0494
